https://www.ozon.ru/product/matiruyushchie-salfetki-colorful-50-sht-tsvet-chaynyy-891600885;Красота и здоровье|Уход за лицом|Матирующие салфетки;;891600885;Матирующие салфетки Colorful, 50 шт, цвет чайный;;<p>Целлюлоза</p>;https://ir.ozone.ru/s3/multimedia-j/wc1000/6584803435.jpg;https://ir.ozone.ru/s3/multimedia-m/wc1000/6584803438.jpg;https://ir.ozone.ru/s3/multimedia-n/wc1000/6584803439.jpg;https://ir.ozone.ru/s3/multimedia-r/wc1000/6584803443.jpg;https://ir.ozone.ru/s3/multimedia-x/wc1000/6584803449.jpg;https://ir.ozone.ru/s3/multimedia-z/wc1000/6584803451.jpg;;Матирующие салфетки;;;Китай;;;Лицо;;;;;;;0.013;;;;;;;;;;;;;;;;;;;;;;;;
https://www.ozon.ru/product/beauty-fox-matiruyushchie-salfetki-dlya-litsa-grl-pwr-2-nabora-po-50-shtuk-948526674;Красота и здоровье|Уход за лицом|Матирующие салфетки|BEAUTY FOX;BEAUTY FOX;948526674;Beauty Fox Матирующие салфетки для лица GRL PWR, 2 набора по 50 штук;"<div><!----> <div class=""""><div class=""pl8"" style=""""><div class=""ra-a1"">Beauty Fox Матирующие салфетки для лица GRL PWR, 2 набора по 50 штук. Абсорбирующая бумага поглощает излишки жира и кожного сала. Салфетки моментально избавляют от жирного блеска и помогают освежить кожу, не пересушивая её и не нарушая макияж. Состав: целлюлоза, экстракт льна, экстракт алоэ.</div></div> <!----> <!----></div> <!----></div>";<p>целлюлоза, экстракт льна, экстракт алоэ</p><h3>Способ применения</h3><p>поместите салфетки на блестящие/жирные участки лица и аккуратно промокните</p>;https://ir.ozone.ru/s3/multimedia-h/wc1000/6130785101.jpg;https://ir.ozone.ru/s3/multimedia-r/wc1000/6130785111.jpg;https://ir.ozone.ru/s3/multimedia-s/wc1000/6130785112.jpg;https://ir.ozone.ru/s3/multimedia-1/wc1000/6130785121.jpg;https://ir.ozone.ru/s3/multimedia-e/wc1000/6130785134.jpg;https://ir.ozone.ru/s3/multimedia-9/wc1000/6499089789.jpg;https://ir.ozone.ru/s3/multimedia-5/wc1000/6499089785.jpg;Матирующие салфетки;;;Китай;Пакет;;Лицо;Дневной уход;;2;;;Натуральные экстракты, Проверено дерматологами;;;;https://ir.ozone.ru/s3/multimedia-6/wc1000/6499089786.jpg;;;;;Жирная, Комбинированная;Растительный экстракт;;от 18 лет;Матирование;;;;;;;;;;;;
https://www.ozon.ru/product/matiruyushchie-salfetki-dlya-litsa-pudrovyy-shik-s-ekstraktom-aloe-50-sht-922334752;Красота и здоровье|Уход за лицом|Матирующие салфетки;;922334752;"Матирующие салфетки для лица ""Пудровый шик"" с экстрактом алоэ, 50 шт";;<p>Смотрите на упаковке</p>;https://ir.ozone.ru/s3/multimedia-l/wc1000/6534446229.jpg;https://ir.ozone.ru/s3/multimedia-j/wc1000/6534446227.jpg;https://ir.ozone.ru/s3/multimedia-k/wc1000/6534446228.jpg;https://ir.ozone.ru/s3/multimedia-p/wc1000/6534446233.jpg;;;;Матирующие салфетки;;;Китай;;;Лицо;;;;;;;0.01;;;;;;;;;;;;;;;;;;;;;;;;
https://www.ozon.ru/product/matiruyushchie-salfetki-dlya-litsa-vzhuh-i-ty-edinorog-50-sht-560289039;Красота и здоровье|Уход за лицом|Матирующие салфетки|BEAUTY FOX;BEAUTY FOX;560289039;"Матирующие салфетки для лица ""ВЖУХ! И ты единорог!"", 50 шт";"<div><!----> <div class=""""><div class=""pl8"" style=""""><div class=""ra-a1"">Матирующие салфетки для лица ""ВЖУХ! И ты единорог!"", 50 шт. Состав: целлюлоза, экстракт льна, экстракт алоэ.</div></div> <!----> <!----></div> <!----></div>";<p>Смотрите на упаковке</p>;https://ir.ozone.ru/s3/multimedia-x/wc1000/6130785081.jpg;https://ir.ozone.ru/s3/multimedia-2/wc1000/6130785086.jpg;https://ir.ozone.ru/s3/multimedia-g/wc1000/6130785100.jpg;https://ir.ozone.ru/s3/multimedia-9/wc1000/6130785129.jpg;https://ir.ozone.ru/s3/multimedia-q/wc1000/6130785146.jpg;;;Матирующие салфетки;;;Китай;;;Лицо;;;;;;;;;;;;;;;Жирная, Комбинированная;;;;;;;;;;;;;;;;
https://www.ozon.ru/product/beauty-fox-matiruyushchie-salfetki-dlya-litsa-mechtay-siyay-2-nabora-po-50-shtuk-955104353;Красота и здоровье|Уход за лицом|Матирующие салфетки|BEAUTY FOX;BEAUTY FOX;955104353;"Beauty Fox Матирующие салфетки для лица ""Мечтай сияй"", 2 набора по 50 штук";"<div><!----> <div class=""""><div class=""pl8"" style=""""><div class=""ra-a1"">Beauty Fox Матирующие салфетки для лица «Мечтай сияй», 2 набора по 50 штук. Абсорбирующая бумага поглощает излишки жира и кожного сала. Салфетки моментально избавляют от жирного блеска и помогают освежить кожу, не пересушивая её и не нарушая макияж. Состав: целлюлоза, экстракт льна, экстракт алоэ.</div></div> <!----> <!----></div> <!----></div>";<p>целлюлоза, экстракт льна, экстракт алоэ</p><h3>Способ применения</h3><p>поместите салфетки на блестящие/жирные участки лица и аккуратно промокните</p>;https://ir.ozone.ru/s3/multimedia-o/wc1000/6130785108.jpg;https://ir.ozone.ru/s3/multimedia-u/wc1000/6130785114.jpg;https://ir.ozone.ru/s3/multimedia-8/wc1000/6130785128.jpg;https://ir.ozone.ru/s3/multimedia-o/wc1000/6130785144.jpg;https://ir.ozone.ru/s3/multimedia-x/wc1000/6130785153.jpg;https://ir.ozone.ru/s3/multimedia-9/wc1000/6499089789.jpg;https://ir.ozone.ru/s3/multimedia-5/wc1000/6499089785.jpg;Матирующие салфетки;;;Китай;Пакет;;Лицо;Дневной уход;;2;;;Натуральные экстракты, Проверено дерматологами;;;;https://ir.ozone.ru/s3/multimedia-6/wc1000/6499089786.jpg;;;;;Жирная, Комбинированная;Растительный экстракт;;от 18 лет;Матирование;;;;;;;;;;;;
https://www.ozon.ru/product/matiruyushchie-salfetki-dlya-litsa-vzhuh-i-ty-edinorog-50-sht-840678694;Красота и здоровье|Уход за лицом|Матирующие салфетки;;840678694;Матирующие салфетки для лица ВЖУХ! И ты единорог!, 50 шт;"<div><!----> <div class=""""><div class=""pl8"" style=""""><div class=""ra-a1"">Матирующие салфетки для лица ВЖУХ! И ты единорог!, 50 шт. Состав: целлюлоза, экстракт льна, экстракт алоэ.</div></div> <!----> <!----></div> <!----></div>";<p>См. на упаковке</p>;https://ir.ozone.ru/s3/multimedia-i/wc1000/6372414582.jpg;https://ir.ozone.ru/s3/multimedia-j/wc1000/6372414583.jpg;https://ir.ozone.ru/s3/multimedia-l/wc1000/6372414585.jpg;https://ir.ozone.ru/s3/multimedia-m/wc1000/6372414586.jpg;https://ir.ozone.ru/s3/multimedia-k/wc1000/6372414584.jpg;;;Матирующие салфетки;;;Китай;Пакет;;Лицо;;;;;;;;;;;;;;;Комбинированная, Жирная;;;;Матирование;;;;;;;;;;;;
https://www.ozon.ru/product/matiruyushchie-salfetki-natural-aroma-50-sht-s-aromatom-okeana-885676562;Красота и здоровье|Уход за лицом|Матирующие салфетки;;885676562;Матирующие салфетки Natural Aroma, 50 шт, с ароматом океана;;<p>Целлюлоза, натуральный ароматизатор</p>;https://ir.ozone.ru/s3/multimedia-0/wc1000/6579059328.jpg;https://ir.ozone.ru/s3/multimedia-z/wc1000/6579059399.jpg;https://ir.ozone.ru/s3/multimedia-y/wc1000/6579059398.jpg;https://ir.ozone.ru/s3/multimedia-x/wc1000/6579059397.jpg;https://ir.ozone.ru/s3/multimedia-1/wc1000/6579059401.jpg;;;Матирующие салфетки;;;Китай;;;Лицо;;;;;;;0.012;;;;;;;;;;;;;;;;;;;;;;;;
https://www.ozon.ru/product/matiruyushchie-salfetki-dlya-litsa-mechtay-siyay-50-sht-688157021;Красота и здоровье|Уход за лицом|Матирующие салфетки;;688157021;Матирующие салфетки для лица Мечтай сияй , 50 шт;"<div><!----> <div class=""""><div class=""pl8"" style=""""><div class=""ra-a1"">Состав: целлюлоза, экстракт льна, экстракт алоэ.</div></div> <!----> <!----></div> <!----></div>";<p>См. на упаковке</p>;https://ir.ozone.ru/s3/multimedia-o/wc1000/6130785108.jpg;https://ir.ozone.ru/s3/multimedia-u/wc1000/6130785114.jpg;https://ir.ozone.ru/s3/multimedia-8/wc1000/6130785128.jpg;https://ir.ozone.ru/s3/multimedia-o/wc1000/6130785144.jpg;https://ir.ozone.ru/s3/multimedia-x/wc1000/6130785153.jpg;;;Матирующие салфетки;;;Китай;;;Лицо;;;;;;;0.012;;;;;;;;Комбинированная;;;;;;;;;;;;;;;;
https://www.ozon.ru/product/matiruyushchie-salfetki-colorful-50-sht-tsvet-goluboy-885663363;Красота и здоровье|Уход за лицом|Матирующие салфетки;;885663363;Матирующие салфетки Colorful, 50 шт, цвет голубой;;<p>Целлюлоза</p>;https://ir.ozone.ru/s3/multimedia-i/wc1000/6579059598.jpg;https://ir.ozone.ru/s3/multimedia-k/wc1000/6579059564.jpg;https://ir.ozone.ru/s3/multimedia-g/wc1000/6579059560.jpg;https://ir.ozone.ru/s3/multimedia-p/wc1000/6579059605.jpg;https://ir.ozone.ru/s3/multimedia-l/wc1000/6579059565.jpg;;;Матирующие салфетки;;;Китай;;;Лицо;;;;;;;0.013;;;;;;;;;;;;;;;;;;;;;;;;
https://www.ozon.ru/product/matiruyushchie-salfetki-colorful-50-sht-tsvet-belyy-885663308;Красота и здоровье|Уход за лицом|Матирующие салфетки;;885663308;Матирующие салфетки Colorful, 50 шт, цвет белый;;<p>Целлюлоза</p>;https://ir.ozone.ru/s3/multimedia-v/wc1000/6579059431.jpg;https://ir.ozone.ru/s3/multimedia-7/wc1000/6579059479.jpg;https://ir.ozone.ru/s3/multimedia-g/wc1000/6579059416.jpg;https://ir.ozone.ru/s3/multimedia-f/wc1000/6579059415.jpg;https://ir.ozone.ru/s3/multimedia-6/wc1000/6579059478.jpg;;;Матирующие салфетки;;;Китай;;;Лицо;;;;;;;0.013;;;;;;;;;;;;;;;;;;;;;;;;
https://www.ozon.ru/product/matiruyushchie-salfetki-natural-extract-premium-50-sht-s-ekstraktom-rozy-885664954;Красота и здоровье|Уход за лицом|Матирующие салфетки;;885664954;Матирующие салфетки Natural Extract Premium, 50 шт, с экстрактом розы;;<p>Целлюлоза, экстракт цветка розы, натуральный ароматизатор</p>;https://ir.ozone.ru/s3/multimedia-u/wc1000/6579059502.jpg;https://ir.ozone.ru/s3/multimedia-4/wc1000/6579059512.jpg;https://ir.ozone.ru/s3/multimedia-m/wc1000/6579059494.jpg;https://ir.ozone.ru/s3/multimedia-b/wc1000/6579059483.jpg;https://ir.ozone.ru/s3/multimedia-u/wc1000/6579059430.jpg;;;Матирующие салфетки;;;Китай;;;Лицо;;;;;;;0.013;;;;;;;;;;;;;;;;;;;;;;;;
https://www.ozon.ru/product/salfetki-dlya-litsa-etude-organix-volcanic-matiruyushchie-s-zelenym-chaem-50sht-788503171;Красота и здоровье|Уход за лицом|Матирующие салфетки;;788503171;Салфетки для лица Etude Organix Volcanic матирующие с зеленым чаем 50шт;;"<p>Состав набора:
Экстракт зеленого чая, экстракт вулканического пепла.</p>";https://ir.ozone.ru/s3/multimedia-g/wc1000/6466165996.jpg;;;;;;;Матирующие салфетки;;;;;;Лицо;;;;;;;;;;;;;;;Для всех типов кожи;;;;;;;;;;;;;;;;
https://www.ozon.ru/product/matiruyushchie-salfetki-papier-matifiant-50sht-788503140;Красота и здоровье|Уход за лицом|Матирующие салфетки;;788503140;Матирующие салфетки Papier Matifiant 50шт;;"<p>Состав набора:
Cellulose (Wood and Jute Palp), Talk.</p>";https://ir.ozone.ru/s3/multimedia-i/wc1000/6466165998.jpg;;;;;;;Матирующие салфетки;;;;;;Лицо;;;;;;;;;;;;;;;Для всех типов кожи;;;;;;;;;;;;;;;;
https://www.ozon.ru/product/salfetki-dlya-litsa-deco-matiruyushchie-s-ekstraktom-bambuka-100-sht-1-sht-939813955;Красота и здоровье|Уход за лицом|Матирующие салфетки|DECO.;DECO.;939813955;Салфетки для лица DECO.  матирующие с экстрактом бамбука 100 шт - 1 шт;"<div><!----> <div class=""""><div class=""pl8"" style=""""><div class=""ra-a1"">Матирующие салфетки для лица эффективно абсорбируют жирный блеск, что позволяет сохранить макияж в идеальном состоянии. Салфетки моментально впитывают излишки жира, придавая коже матовость и свежий ухоженный вид. Секрет от DECO. : Регулярное применение матирующих салфеток позволяет контролировать работу сальных желез на проблемных зонах.
Способ применения:аккуратно промокните салфеткой блестящие участки кожи, чтобы моментально устранить излишек жира. Каждый раз используйте новую салфетку.
Состав: wood pulp, jute pulp.</div></div> <!----> <!----></div> <!----></div>";<p>wood pulp, jute pulp.</p><h3>Способ применения</h3><p>аккуратно промокните салфеткой блестящие участки кожи, чтобы моментально устранить излишек жира. Каждый раз используйте новую салфетку.</p>;https://ir.ozone.ru/s3/multimedia-m/wc1000/6493965634.jpg;https://ir.ozone.ru/s3/multimedia-h/wc1000/6493965629.jpg;https://ir.ozone.ru/s3/multimedia-i/wc1000/6493965630.jpg;https://ir.ozone.ru/s3/multimedia-7/wc1000/6493965619.jpg;https://ir.ozone.ru/s3/multimedia-8/wc1000/6493965656.jpg;;;Матирующие салфетки;;;Китай;Пакет;;Лицо;Дневной уход;;1;;;Подходит для ежедневного применения;50;;;;;;;;Для всех типов кожи;;;от 14 лет;Матирование;;;;;;;;;;;;
https://www.ozon.ru/product/ducare-matiruyushchie-salfetki-dlya-litsa-100-sht-green-tea-oil-absorbing-paper-944209925;Красота и здоровье|Уход за лицом|Матирующие салфетки|DUcare;DUcare;944209925;DUcare Матирующие салфетки для лица (100 шт.), Green Tea Oil-Absorbing Paper;"<div><!----> <div class=""lp9""><div class=""pl8"" style=""max-height: 700px;""><div><div class=""ra-a""><div class=""ra-b2""><div><div class=""ra-g2 ra-g6 ra-g7 ra-h2 ra-b4""><div style=""padding-top: 61.8557%; display: block;""><img loading=""lazy"" fetchpriority=""low"" src=""https://ir.ozone.ru/s3/multimedia-s/6627335680.jpg"" class=""ra-h z7-a""></div></div></div><div><div class=""ra-g2 ra-g6 ra-g9 ra-h2 ra-b4""><div style=""padding-top: 61.8557%; display: block;""><img loading=""lazy"" fetchpriority=""low"" src=""https://ir.ozone.ru/s3/multimedia-c/6627335664.jpg"" class=""ra-h z7-a""></div></div></div><div><div class=""ra-g2 ra-g6 ra-g9 ra-h2 ra-b4""><div style=""padding-top: 61.8557%; display: block;""><img loading=""lazy"" fetchpriority=""low"" src=""https://ir.ozone.ru/s3/multimedia-j/6627335671.jpg"" class=""ra-h z7-a""></div></div></div><div><div class=""ra-g2 ra-g6 ra-g9 ra-h2 ra-b4""><div style=""padding-top: 61.8557%; display: block;""><img loading=""lazy"" fetchpriority=""low"" src=""https://ir.ozone.ru/s3/multimedia-p/6627335677.jpg"" class=""ra-h z7-a""></div></div></div><div><div class=""ra-g2 ra-g6 ra-g9 ra-h2 ra-b4""><div style=""padding-top: 61.8557%; display: block;""><img loading=""lazy"" fetchpriority=""low"" src=""https://ir.ozone.ru/s3/multimedia-0/6627335652.jpg"" class=""ra-h z7-a""></div></div></div><div><div class=""ra-g2 ra-g6 ra-g8 ra-h2 ra-b4""><div style=""padding-top: 61.8557%; display: block;""><img loading=""lazy"" fetchpriority=""low"" src=""https://ir.ozone.ru/s3/multimedia-e/6627335702.jpg"" class=""ra-h z7-a""></div></div></div></div></div></div></div> <div class=""p8l""></div> <div class=""x5-a""><button tabindex=""0"" type=""button"" class=""x5-a1""><span class=""x5-a3 x5-b7""><span class=""x5-e4"">Показать полностью</span></span></button></div></div> <!----></div>";<p>?? Высшая абсорбционная ткань ?? Изготовлен из 100% натуральной льняной волокнистой бумаги и зеленого чая без добавления специй или запахов. Идеально подходит для чувствительной кожи, без раздражения, при удалении избыточного жира и кожного жира.</p>;https://ir.ozone.ru/s3/multimedia-v/wc1000/6627335683.jpg;https://ir.ozone.ru/s3/multimedia-r/wc1000/6627335751.jpg;https://ir.ozone.ru/s3/multimedia-o/wc1000/6627335712.jpg;https://ir.ozone.ru/s3/multimedia-n/wc1000/6627335639.jpg;https://ir.ozone.ru/s3/multimedia-q/wc1000/6627335678.jpg;https://ir.ozone.ru/s3/multimedia-e/wc1000/6627335738.jpg;https://ir.ozone.ru/s3/multimedia-2/wc1000/6627335690.jpg;Матирующие салфетки;;;Китай;Картонная коробка;;Лицо, Нос, Область вокруг глаз, Руки, Тело, Шея, Губы, Ноги, Ягодицы, Грудь;Для умывания, Дневной уход, От пота и запаха, Снятие макияжа, SPA;;100;;;Подходит для ежедневного применения, Проверено дерматологами;;;;https://ir.ozone.ru/s3/multimedia-t/wc1000/6627335753.jpg;https://ir.ozone.ru/s3/multimedia-1/wc1000/6627335725.jpg;https://ir.ozone.ru/s3/multimedia-y/wc1000/6627335758.jpg;;;Для всех типов кожи, Жирная, Зрелая, Комбинированная, Нормальная;;;;Восстановление, Защита, Матирование, Осветление, Очищение, Увлажнение, Тонизирование;;;;https://ir.ozone.ru/s3/multimedia-2/wc1000/6627335762.jpg;https://ir.ozone.ru/s3/multimedia-o/wc1000/6627335748.jpg;https://ir.ozone.ru/s3/multimedia-i/wc1000/6627335742.jpg;;https://ir.ozone.ru/s3/multimedia-h/wc1000/6627335705.jpg;;;;
https://www.ozon.ru/product/matiruyushchie-salfetki-colorful-50-sht-tsvet-zelenyy-891601645;Красота и здоровье|Уход за лицом|Матирующие салфетки;;891601645;Матирующие салфетки Colorful, 50 шт, цвет зелёный;;<p>Целлюлоза</p>;https://ir.ozone.ru/s3/multimedia-k/wc1000/6584803472.jpg;https://ir.ozone.ru/s3/multimedia-m/wc1000/6584803474.jpg;https://ir.ozone.ru/s3/multimedia-c/wc1000/6579059520.jpg;https://ir.ozone.ru/s3/multimedia-u/wc1000/6579059538.jpg;https://ir.ozone.ru/s3/multimedia-l/wc1000/6584803473.jpg;;;Матирующие салфетки;;;Китай;;;Лицо;;;;;;;0.013;;;;;;;;;;;;;;;;;;;;;;;;
