url;Категория;Бренд;Артикул;Наименование;Описание;Состав;Изображение 1;Изображение 2;Изображение 3;Изображение 4;Изображение 5;Изображение 6;Изображение 7;Тип;Бренд;Серии;Страна-изготовитель;Упаковка;Вид набора;Область использования;Применение;Пол;Единиц в одном товаре;Вес товара, г;Объем, мл;Особенности состава;Вес, г;Эффект;Тип волос;Изображение 8;Изображение 9;Изображение 10;Солнцезащитная косметика;Форма выпуска;Тип кожи;Бьюти-ингредиент;Целевая аудитория;Возрастной диапазон;Эффект от использования уходовой косметики;Уровень pH;Бьюти-ингредиент;SPF;Изображение 11;Изображение 12;Изображение 13;Вид маски;Изображение 14;Изображение 15;Возраст ребенка;Изображение 16;варианты;Цвет;Материал;Основной материал;Способ применения;Комплектация;Гарантийный срок;Питание;Режимы;Результат применения аппарата;Изображение 17;Изображение 18;Плотность пасты;О товаре;Номинал;Праздник
https://www.ozon.ru/product/matiruyushchie-salfetki-2-upakovki-v-nabore-200-shtuk-dlya-litsa-ot-zhirnogo-bleska-fashion-924300589;Красота и здоровье|Уход за лицом|Матирующие салфетки|ТОПчик;ТОПчик;924300589;Матирующие салфетки 2 упаковки в наборе -200 штук  / для лица от жирного блеска   Fashion / косметические салфетки для всех типов кожи;"<div><!----> <div class=""lp9""><div class=""pl8"" style=""max-height: 700px;""><div><div class=""ra-a""><div class=""ra-b2""><div class=""ra-b6""><div class=""ra-g2 ra-g6 ra-h2 ra-b7 ra-b4""><a href=""https://www.ozon.ru/product/top-924300588/?oos_search=false&amp;sh=mvXCMMbmYw"" style=""padding-top: 100%; display: block;""><img loading=""lazy"" fetchpriority=""low"" src=""https://ir.ozone.ru/graphics/new_no_photo.png"" alt=""Все товары продавца"" class=""ra-h z7-a""></a></div><div class=""ra-a4 ra-b""><span class=""ra-a5 ra-i7 ra-j ra-j4 ra-j9""><span>МАТИРУЮЩИЕ САЛФЕТКИ ДЛЯ ЛИЦА</span></span><span class=""ra-i7 ra-i8 ra-j4 ra-j9""><span>Салфетки матирующие для лица&nbsp; - это легкий и удобный способ убрать жирный блеск с лица не пересушивая кожу и не&nbsp;повреждая макияж.</span></span></div></div></div></div><div class=""ra-a""><div class=""ra-b2 ra-c2""><div class=""ra-c4 ra-c6""><div class=""ra-g2 ra-g6 ra-h0 ra-g3 ra-b7""><a href=""https://www.ozon.ru/product/top-924300588/?oos_search=false&amp;sh=mvXCMMbmYw"" style=""padding-top: 100%; display: block;""><img loading=""lazy"" fetchpriority=""low"" src=""https://ir.ozone.ru/s3/multimedia-w/6600081776.jpg"" alt=""Все товары продавца"" class=""ra-h z7-a""></a></div><div class=""ra-a4 ra-b""><span class=""ra-a5 ra-a6 ra-i7 ra-j ra-j4 ra-j9""><span>Универсальность</span></span><span class=""ra-i7 ra-i8 ra-j4 ra-j8""><span>Матирующие салфетки для лица  моментально удаляют жирный блеск с Т-зоны , не повреждая макияж , так что тональная основа для лица сохраняется в идеальном состоянии, чего не делают салфетки бумажные. Многие из нас сталкиваются с проблемой жирного блеска на лице, это может быть довольно неприятно и сильно ослаблять уверенность. Однако, есть способ избавиться от этой проблемы - матирующие салфетки для лица. Матирующие салфетки - это легкий и удобный способ убрать жирный блеск с лица не пересушивая кожу, в то время как пудра для лица дает обратный эффект . Салфетки матирующие для лица обладают способностью поглощать излишки кожного жира и сохранять кожу свежей и матовой. Они гораздо эффективнее чем: стерильные салфетки, влажные салфетки, бамбуковые салфетки, влажные детские салфетки и матирующий роллер (ролик) для лица. Заменяет фиксатор для макияжа и матирующий спрей .</span><br><span></span></span></div></div><div class=""ra-c4 ra-c6""><div class=""ra-g2 ra-g6 ra-h0 ra-g3 ra-b7""><a href=""https://www.ozon.ru/product/top-924300588/?oos_search=false&amp;sh=mvXCMMbmYw"" style=""padding-top: 100%; display: block;""><img loading=""lazy"" fetchpriority=""low"" src=""https://ir.ozone.ru/s3/multimedia-b/6614802155.jpg"" alt=""Все товары продавца"" class=""ra-h z7-a""></a></div><div class=""ra-a4 ra-b""><span class=""ra-a5 ra-a6 ra-i7 ra-j ra-j4 ra-j9""><span>Простота в использовании&nbsp;</span></span><span class=""ra-i7 ra-i8 ra-j4 ra-j8""><span> Использование матирующих салфеток: Возьмите одну салфетку и аккуратно нанесите ее на лицо, прижимая к тем местам, где жирный блеск наиболее заметен. Держите салфетку на коже несколько секунд, чтобы она успела поглотить излишки кожного жира. Затем просто выбросьте использованную салфетку и повторите процедуру при необходимости.</span><br><span>    	Матирующие салфетки для лица - это своего рода минеральная пудра для лица, потому что  благодаря им можно быстро избавиться от  жирного блеска с лица и вам даже не понадобиться тоник для жирной кожи лица. Салфетки для уборки жирного блеска могут быть очень полезны, особенно в течение дня, а также на  фотосесcии  или визажисту при завершении make-up.</span><br><span></span><br><span></span></span></div></div><div class=""ra-c4 ra-c6""><div class=""ra-g2 ra-g6 ra-h0 ra-g3 ra-b7""><a href=""https://www.ozon.ru/product/top-924300588/?oos_search=false&amp;sh=mvXCMMbmYw"" style=""padding-top: 100%; display: block;""><img loading=""lazy"" fetchpriority=""low"" src=""https://ir.ozone.ru/s3/multimedia-0/6616453644.jpg"" alt=""Все товары продавца"" class=""ra-h z7-a""></a></div><div class=""ra-a4 ra-b""><span class=""ra-a5 ra-a6 ra-i7 ra-j ra-j4 ra-j9""><span>Удобство</span></span><span class=""ra-i7 ra-i8 ra-j4 ra-j8""><span>В наборе два комплекта матирующих салфеток по 100 штук, это УДОБНО одну упаковку можно оставить дома (в машине или в другой сумочке ) а одну взять с собой. Особенно удобно брать в роддом, в самолет, на праздник, в больницу, для путешествий, для поездок. Не забывайте о них и добавьте этот аксессуар для макияжа в свой набор для макияжа. Ваша кожа будет вам благодарна!
</span><br><span>Отлично подойдут на подарок маме, женщине, девушке, подруге, сестре, для подружек невесты, на день рождения, на 8 марта, на свадьбу.
</span><br><span></span></span></div></div></div></div></div></div> <div class=""p8l""></div> <div class=""x5-a""><button tabindex=""0"" type=""button"" class=""x5-a1""><span class=""x5-a3 x5-b7""><span class=""x5-e4"">Показать полностью</span></span></button></div></div> <!----></div>";"<p>Целлюлоза
</p><h3>Способ применения</h3><p>Возьмите одну салфетку и поднесите ее к лицу, прижимая к тем местам, где жирный блеск наиболее заметен. Держите салфетку на коже несколько секунд, чтобы она успела поглотить излишки кожного жира. Затем просто выбросьте использованную салфетку и повторите процедуру при необходимости.</p>";https://ir.ozone.ru/s3/video-15/01GXENYYVH9S6VMF9FHNZK57K4/cover/wc1000/cover.jpg;https://ir.ozone.ru/s3/multimedia-p/wc1000/6625463893.jpg;https://ir.ozone.ru/s3/multimedia-a/wc1000/6614802154.jpg;https://ir.ozone.ru/s3/multimedia-0/wc1000/6616453644.jpg;https://ir.ozone.ru/s3/multimedia-w/wc1000/6600081776.jpg;https://ir.ozone.ru/s3/multimedia-e/wc1000/6600081974.jpg;https://ir.ozone.ru/s3/multimedia-b/wc1000/6614802155.jpg;Матирующие салфетки;;Новые технологии;Китай;Картонная коробка;;Лицо;Дневной уход;;2;;;Гипоаллергенная, Органическая косметика, Подходит для ежедневного применения, Проверено дерматологами, Эко-товар;30;;;https://ir.ozone.ru/s3/multimedia-2/wc1000/6616453646.jpg;https://ir.ozone.ru/s3/multimedia-3/wc1000/6616453647.jpg;https://ir.ozone.ru/s3/multimedia-f/wc1000/6600081759.jpg;;;Для всех типов кожи, Жирная, Зрелая, Комбинированная, Нормальная;;;от 12 лет;Матирование;5,5;;;;;;;;;;;
https://www.ozon.ru/product/etude-organix-volcanic-salfetki-matiruyushchie-dlya-litsa-s-zelenym-chaem-i-vulkanicheskim-peplom-3-301734844;Красота и здоровье|Уход за лицом|Матирующие салфетки|Etude Organix;Etude Organix;301734844;ETUDE ORGANIX Volcanic Салфетки матирующие  для лица с зеленым чаем и  вулканическим пеплом, 3 шт х 12 г;"<div><!----> <div class=""""><div class=""pl8"" style=""""><div class=""ra-a1"">Абсорбирующая бумага из конопляных волокон с добавлением зеленого чая и вулканического пепла поглощает излишки жира и кожного сала. Салфетки моментально избавляют от жирного блеска и помогают освежить кожу, не пересушивая её</div></div> <!----> <!----></div> <!----></div>";<p>hemp paper, camelia sinensis (green tea) extract, volcanic ash extract.</p><h3>Способ применения</h3><p>Поместите салфетки на блестящие/жирные участки лица и аккуратно промокните - для мгновенного матового результата!</p>;https://ir.ozone.ru/s3/multimedia-e/wc1000/6439071278.jpg;https://ir.ozone.ru/s3/multimedia-g/wc1000/6283121116.jpg;https://ir.ozone.ru/s3/multimedia-s/wc1000/6051387508.jpg;https://ir.ozone.ru/s3/multimedia-3/wc1000/6085572147.jpg;;;;Матирующие салфетки;;;Китай;Картонный конверт;;Лицо;Дневной уход;;;;;;;;;;;;;;Для всех типов кожи, Комбинированная;;;от 16 лет;Матирование;;;;;;;;;;;;
https://www.ozon.ru/product/limoni-matiruyushchie-salfetki-dlya-litsa-osvezhayushchie-kosmeticheskie-dlya-zhirnoy-305043426;Красота и здоровье|Уход за лицом|Матирующие салфетки|Limoni;Limoni;305043426;LIMONI Матирующие салфетки для лица освежающие косметические для жирной и комбинированной кожи белые 240 шт / С зеленым чаем / Matte Blotting Papers 3 упаковки;"<div><!----> <div class=""lp9""><div class=""pl8"" style=""max-height: 700px;""><div><div class=""ra-a""><div class=""ra-b2""><div class=""ra-b9""><div class=""ra-g2 ra-g6 ra-h1 ra-g3 ra-c1""><a href=""https://www.ozon.ru/context/detail/id/305043426/"" style=""padding-top: 100%; display: block;""><img loading=""lazy"" fetchpriority=""low"" src=""https://ir.ozone.ru/s3/multimedia-p/6231154945.jpg"" alt=""Матирующие салфетки для лица от LIMONI помогут сохранить безупречный тон кожи с матовой Т-зоной в течение всего дня. Салфетки деликатно избавляют кожу от жирного блеска, предупреждая закупорку пор кожным салом, придают ей свежесть, матовость и бархатистость, при этом оставляя макияж нетронутым. Каждая салфетка из натуральной древесной пульпы обладает выраженными абсорбирующими свойствами."" class=""ra-h z7-a""></a></div><div class=""ra-c0""><div class=""ra-a4 ra-b""><span class=""ra-a5 ra-i7 ra-j0 ra-j4 ra-j8""><span>Matte Blotting Papers</span></span><span class=""ra-i7 ra-i9 ra-j4 ra-j8""><span>Матирующие салфетки для лица от LIMONI помогут сохранить безупречный тон кожи с матовой Т-зоной в течение всего дня. Салфетки деликатно избавляют кожу от жирного блеска, предупреждая закупорку пор кожным салом, придают ей свежесть, матовость и бархатистость, при этом оставляя макияж нетронутым. Каждая салфетка из натуральной древесной пульпы обладает выраженными абсорбирующими свойствами.</span></span></div></div></div><div class=""ra-b9 ra-c""><div class=""ra-g2 ra-g6 ra-h1 ra-g3 ra-c1""><a href=""https://www.ozon.ru/product/limoni-matiruyushchie-salfetki-dlya-litsa-belye-240-sht-s-zelenym-chaem-matte-blotting-papers-305043426/?sh=rKu9iF75dg"" style=""padding-top: 100%; display: block;""><img loading=""lazy"" fetchpriority=""low"" src=""https://ir.ozone.ru/s3/multimedia-l/6231155013.jpg"" alt=""Вечеринка, путешествие, целый день в офисе — в любое время и в любой ситуации ваша кожа будет выглядеть идеально. Универсальный продукт, который подойдет как для женщин, так и для мужчин.Матирующие салфетки LIMONI упакованы в небольшой тонкий конвертик из плотного картона, который всегда будет под рукой."" class=""ra-h z7-a""></a></div><div class=""ra-c0""><div class=""ra-a4 ra-b""><span class=""ra-a5 ra-i7 ra-j0 ra-j4 ra-k""><span>Компактный помощник для кожи</span><br><span></span></span><span class=""ra-i7 ra-i9 ra-j4 ra-k""><span>Вечеринка, путешествие, целый день в офисе — в любое время и в любой ситуации ваша кожа будет выглядеть идеально. Универсальный продукт, который подойдет как для женщин, так и для мужчин.Матирующие салфетки LIMONI упакованы в небольшой тонкий конвертик из плотного картона, который всегда будет под рукой.</span></span></div></div></div></div></div><ul class=""ra-d ra-a""><li class=""ra-i7 ra-j0 ra-j4 ra-j8 ra-d1""><div class=""ra-a4 ra-b""><span class=""ra-a5 ra-a6 ra-i7 ra-j0 ra-j4 ra-j8""><span>Ирина О. ?????</span><br><span></span></span><span class=""ra-i7 ra-i9 ra-j4 ra-j8""><span>1, максимум 2х салфеток хватет ддя всего лица! У меня очень сильно жирнится кода в Т-зоне, тоненьких салфеток за 1 раз уходит 4-5 штук. Эти салфетки довольно плотные, я очень довольна! На фото сравниваю их (белого цвета) со своими старыми (розовые, какой-то китайский NoBrand??). Limoni в 100 раз лучше и качественнее! Однозначно советую к покупке!</span></span></div></li><li class=""ra-i7 ra-j0 ra-j4 ra-j8 ra-d1""><div class=""ra-a4 ra-b""><span class=""ra-a5 ra-a6 ra-i7 ra-j0 ra-j4 ra-j8""><span>Людмила Т. ?????</span><br><span></span></span><span class=""ra-i7 ra-i9 ra-j4 ra-j8""><span>Хорошо впитывает себум! Плотные. Отлично подошли для моей комбинированной и склрнной у жирности коже!!! Одной салфетки, действительно, хватает на целое лицо. Приятный лёгкий едва уловимый аромат. Рекомендую. Не сравнятся с салфетками из магнита косметики. Достойный продукт. Своих денег стоит.</span><br><span></span></span></div></li><li class=""ra-i7 ra-j0 ra-j4 ra-j8 ra-d1""><div class=""ra-a4 ra-b""><span class=""ra-a5 ra-a6 ra-i7 ra-j0 ra-j4 ra-j8""><span>Марина К. ?????</span><br><span></span></span><span class=""ra-i7 ra-i9 ra-j4 ra-j8""><span>Плотность салфеток, качество, матирование кожи, приятный дизайн упаковки, удобно достаются салфетки (скорее всего благодаря плотности бумаги). Не навязчивый аромат. Справляются со своей функцией на 100%. Летом не заменимые помощники.</span><br><span></span></span></div></li></ul><div class=""ra-a""><div class=""ra-b2""><div class=""ra-b9""><div class=""ra-g2 ra-g6 ra-h1 ra-g3 ra-c1""><a href=""https://www.ozon.ru/product/limoni-matiruyushchie-salfetki-dlya-litsa-belye-240-sht-s-zelenym-chaem-matte-blotting-papers-305043426/?sh=rKu9iD6vyQ"" style=""padding-top: 100%; display: block;""><img loading=""lazy"" fetchpriority=""low"" src=""https://ir.ozone.ru/s3/multimedia-f/6231154935.jpg"" alt=""Нежный натуральный аромат зеленого чая поднимет настроение и подарит легчайший аромат коже. Универсальный продукт, который подойдет как для женщин, так и для мужчин. Матирующие салфетки LIMONI упакованы в небольшой тонкий конвертик из плотного картона, который всегда будет под рукой. Рекомендуем использовать матирующие салфетки как самостоятельное средство, позволяющего бороться с жирным блеском без дополнительного слоя пудры и успокаивающее кожу лица. После использования возможно  повторное нанесение закрепляющей пудры."" class=""ra-h z7-a""></a></div><div class=""ra-c0""><div class=""ra-a4 ra-b""><span class=""ra-a5 ra-i7 ra-j0 ra-j4 ra-j8""><span>Преимущества Matte Blotting Papers</span><br><span></span></span><span class=""ra-i7 ra-i9 ra-j4 ra-j8""><span>Нежный натуральный аромат зеленого чая поднимет настроение и подарит легчайший аромат коже. Универсальный продукт, который подойдет как для женщин, так и для мужчин. Рекомендуем использовать матирующие салфетки как самостоятельное средство, позволяющего бороться с жирным блеском без дополнительного слоя пудры и успокаивающее кожу лица. После использования возможно повторное нанесение закрепляющей пудры.</span></span></div></div></div><div class=""ra-b9 ra-c""><div class=""ra-g2 ra-g6 ra-h1 ra-g3 ra-c1""><a href=""https://www.ozon.ru/product/limoni-matiruyushchie-salfetki-dlya-litsa-belye-240-sht-s-zelenym-chaem-matte-blotting-papers-305043426/?sh=rKu9iD6vyQ"" style=""padding-top: 100%; display: block;""><img loading=""lazy"" fetchpriority=""low"" src=""https://ir.ozone.ru/s3/multimedia-y/6231155026.jpg"" alt=""Способ применения: Аккуратно промокните салфеткой те части лица, на которых появился жирный блеск. Каждая салфетка предназначена для однократного применения."" class=""ra-h z7-a""></a></div><div class=""ra-c0""><div class=""ra-a4 ra-b""><span class=""ra-a5 ra-i7 ra-j0 ra-j4 ra-k""><span>Способ применения:</span></span><span class=""ra-i7 ra-i9 ra-j4 ra-k""><span>Аккуратно промокните салфеткой те части лица, на которых появился жирный блеск. Каждая салфетка предназначена для однократного применения.</span></span></div></div></div></div></div></div></div> <div class=""p8l""></div> <div class=""x5-a""><button tabindex=""0"" type=""button"" class=""x5-a1""><span class=""x5-a3 x5-b7""><span class=""x5-e4"">Показать полностью</span></span></button></div></div> <!----></div>";"<p>Мягкая древесная пульпа, отдушка ""Зеленый чай""</p><h3>Способ применения</h3><p>Аккуратно промокните салфеткой те части лица, на которых появился жирный блеск. Каждая салфетка предназначена для однократного применения.</p>";https://ir.ozone.ru/s3/video-12/01GWS2NTAZFFCNMVMHREX1JNKV/cover/wc1000/cover.jpg;https://ir.ozone.ru/s3/multimedia-8/wc1000/6231154964.jpg;https://ir.ozone.ru/s3/multimedia-y/wc1000/6231188578.jpg;https://ir.ozone.ru/s3/multimedia-6/wc1000/6231188622.jpg;https://ir.ozone.ru/s3/multimedia-u/wc1000/6231188646.jpg;https://ir.ozone.ru/s3/multimedia-2/wc1000/6231154994.jpg;https://ir.ozone.ru/s3/multimedia-c/wc1000/6231188592.jpg;Матирующие салфетки;;;Китай;Бумажный пакет;;Лицо;Дневной уход, Для загара;;240;;;Веганская косметика, Вегетарианская косметика, Не тестируется на животных, Подходит для ежедневного применения, Аптечная косметика, Натуральные экстракты, Органическая косметика;;;;https://ir.ozone.ru/s3/multimedia-a/wc1000/6231154930.jpg;https://ir.ozone.ru/s3/multimedia-q/wc1000/6231154946.jpg;https://ir.ozone.ru/s3/multimedia-c/wc1000/6231154968.jpg;;;Для всех типов кожи;Растительный экстракт;;от 16 лет;Матирование, Очищение, Устранение высыпаний, Восстановление;;;;;;;;;;;;"https://www.ozon.ru/product/limoni-matiruyushchie-salfetki-dlya-litsa-ot-zhirnogo-bleska-zelenye-i-lilovye-160-sht-s-zelenym-305122499/?asb=SD%2FWOuiJOM%2FQF4z5mVUMnz6yYbdGLcxbMTHhh5u7jFs%3D&asb2=_sBvJdELNRxEz_yzENu68QqxhHiMZCo1ak-V3msedIkaIw7IYQsj9IBl5fQsWKciV3h6QFv3y7CcsvuPaSh3LsuO_PPUJozi9BlmsM4Zq70&avtc=1&avte=2&avts=1683710322&ectx=1&from_sku=305043426&keywords=%27793289310&oos_search=false&reviewsFilters=eyJ3aXRoTWVkaWEiOnRydWV9&sh=2JECpq0GUg
https://www.ozon.ru/product/limoni-matiruyushchie-salfetki-dlya-litsa-osvezhayushchie-kosmeticheskie-dlya-zhirnoy-305043426/?asb=SD%2FWOuiJOM%2FQF4z5mVUMnz6yYbdGLcxbMTHhh5u7jFs%3D&asb2=_sBvJdELNRxEz_yzENu68QqxhHiMZCo1ak-V3msedIkaIw7IYQsj9IBl5fQsWKciV3h6QFv3y7CcsvuPaSh3LsuO_PPUJozi9BlmsM4Zq70&avtc=1&avte=2&avts=1683710322&from_sku=305043426&keywords=%27793289310&oos_search=false&reviewsFilters=eyJ3aXRoTWVkaWEiOnRydWV9&sh=2JECpq0GUg"
